{
  "$schema": "https://json-schema.org/draft/2020-12/schema",
  "title": "VibeRig Requirement Contract",
  "type": "object",
  "required": ["id", "title", "goals", "rules", "entities", "workflows", "constraints", "risks", "decisions"],
  "additionalProperties": false,
  "properties": {
    "id": { "type": "string", "minLength": 1 },
    "title": { "type": "string", "minLength": 1 },
    "goals": {
      "type": "array",
      "minItems": 1,
      "items": { "$ref": "#/$defs/item" }
    },
    "rules": {
      "type": "array",
      "minItems": 1,
      "items": { "$ref": "#/$defs/item" }
    },
    "entities": {
      "type": "array",
      "items": { "$ref": "#/$defs/entity" }
    },
    "workflows": {
      "type": "array",
      "minItems": 1,
      "items": { "$ref": "#/$defs/workflow" }
    },
    "constraints": {
      "type": "array",
      "items": { "$ref": "#/$defs/item" }
    },
    "risks": {
      "type": "array",
      "items": { "$ref": "#/$defs/item" }
    },
    "decisions": {
      "type": "array",
      "items": { "$ref": "#/$defs/item" }
    }
  },
  "$defs": {
    "item": {
      "type": "object",
      "required": ["id", "text"],
      "additionalProperties": false,
      "properties": {
        "id": { "type": "string", "minLength": 1 },
        "text": { "type": "string", "minLength": 1 }
      }
    },
    "entity": {
      "type": "object",
      "required": ["id", "name", "description"],
      "additionalProperties": false,
      "properties": {
        "id": { "type": "string", "minLength": 1 },
        "name": { "type": "string", "minLength": 1 },
        "description": { "type": "string", "minLength": 1 }
      }
    },
    "workflow": {
      "type": "object",
      "required": ["id", "name", "steps"],
      "additionalProperties": false,
      "properties": {
        "id": { "type": "string", "minLength": 1 },
        "name": { "type": "string", "minLength": 1 },
        "steps": {
          "type": "array",
          "minItems": 1,
          "items": { "type": "string", "minLength": 1 }
        }
      }
    }
  }
}
